{"format":"nativecad/1","units":"mm","meta":{"name":"agent_demo_gallery","created":"2026-06-10T21:14:05","modified":"2026-06-10T21:14:06"},"counter":10,"layers":{"0":{"color":"#222222","visible":true,"line_width":1.0},"walls":{"color":"#263238","visible":true,"line_width":1.5},"dims":{"color":"#7b8794","visible":true,"line_width":0.8},"labels":{"color":"#334155","visible":true,"line_width":1.0},"model":{"color":"#222222","visible":true,"line_width":1.0}},"materials":{"default":{"color":"#9aa0a6","metallic":0.0,"roughness":0.8},"concrete":{"color":"#c9c4b8","metallic":0.0,"roughness":0.85}},"entities":{"e1":{"type":"wall","layer":"walls","path":[[0.0,0.0],[7000.0,0.0],[7000.0,4200.0],[0.0,4200.0],[0.0,0.0]],"thickness":200.0,"openings":[{"at":3500.0,"width":1600.0,"type":"door"},{"at":9100.0,"width":1400.0,"type":"window"},{"at":13000.0,"width":1200.0,"type":"window"}],"height":3000.0,"material":"concrete","tag":"exterior"},"e2":{"type":"wall","layer":"walls","path":[[4200.0,0.0],[4200.0,4200.0]],"thickness":120.0,"openings":[{"at":1500.0,"width":900.0,"type":"door"}],"height":3000.0,"material":"concrete","tag":"partition"},"e3":{"type":"dim","layer":"dims","p1":[0.0,0.0],"p2":[7000.0,0.0],"offset":-900.0},"e4":{"type":"dim","layer":"dims","p1":[0.0,0.0],"p2":[4200.0,0.0],"offset":-500.0},"e5":{"type":"dim","layer":"dims","p1":[4200.0,0.0],"p2":[7000.0,0.0],"offset":-500.0},"e6":{"type":"dim","layer":"dims","p1":[7000.0,0.0],"p2":[7000.0,4200.0],"offset":-700.0},"e7":{"type":"text","layer":"labels","at":[1500.0,2100.0],"text":"SHOWROOM","height":260.0,"rotation":0.0},"e8":{"type":"text","layer":"labels","at":[5000.0,2100.0],"text":"STUDIO","height":260.0,"rotation":0.0},"e9":{"type":"text","layer":"labels","at":[1700.0,-1800.0],"text":"AGENT GENERATED PLAN","height":320.0,"rotation":0.0},"e10":{"type":"solid","layer":"model","mesh":{"vertices":[[-100.0,-100.0,-120.0],[-100.0,-100.0,0.0],[-100.0,4300.0,-120.0],[-100.0,4300.0,0.0],[7100.0,-100.0,-120.0],[7100.0,-100.0,0.0],[7100.0,4300.0,-120.0],[7100.0,4300.0,0.0]],"triangles":[[1,0,4],[2,4,0],[1,3,0],[3,1,5],[3,2,0],[3,7,2],[5,4,6],[5,1,4],[6,4,2],[7,6,2],[7,3,5],[7,5,6]]},"material":"concrete","tag":"slab"}}}