{"format":"modulor/1","units":"mm","meta":{"name":"studio","created":"2026-06-11T19:17:49","modified":"2026-06-11T19:17:50"},"counter":10,"layers":{"0":{"color":"#222222","visible":true,"line_width":1.0},"walls":{"color":"#1f2430","visible":true,"line_width":1.6},"dims":{"color":"#7a8699","visible":true,"line_width":0.8},"labels":{"color":"#3a4256","visible":true,"line_width":1.0},"model":{"color":"#222222","visible":true,"line_width":1.0}},"materials":{"default":{"color":"#9aa0a6","metallic":0.0,"roughness":0.8},"shell":{"color":"#cfc8bb","metallic":0.0,"roughness":0.8}},"params":{},"levels":{},"recipe":[],"entities":{"e1":{"type":"wall","layer":"walls","path":[[0.0,0.0],[8000.0,0.0],[8000.0,5000.0],[0.0,5000.0],[0.0,0.0]],"thickness":240.0,"openings":[{"at":1500.0,"width":1000.0,"type":"door"},{"at":6200.0,"width":1800.0,"type":"window"},{"at":15000.0,"width":1800.0,"type":"window"},{"at":19000.0,"width":1500.0,"type":"window"}],"height":2900.0,"tag":"exterior","material":"shell"},"e2":{"type":"wall","layer":"walls","path":[[5000.0,0.0],[5000.0,5000.0]],"thickness":120.0,"openings":[{"at":4100.0,"width":900.0,"type":"door"}],"height":2900.0,"tag":"partition","material":"shell"},"e3":{"type":"dim","layer":"dims","p1":[0.0,0.0],"p2":[8000.0,0.0],"offset":-1500.0},"e4":{"type":"dim","layer":"dims","p1":[0.0,0.0],"p2":[5000.0,0.0],"offset":-800.0},"e5":{"type":"dim","layer":"dims","p1":[5000.0,0.0],"p2":[8000.0,0.0],"offset":-800.0},"e6":{"type":"dim","layer":"dims","p1":[8000.0,0.0],"p2":[8000.0,5000.0],"offset":-800.0},"e7":{"type":"text","layer":"labels","at":[2000.0,2400.0],"text":"LIVING","height":300.0,"rotation":0.0},"e8":{"type":"text","layer":"labels","at":[5900.0,2400.0],"text":"BEDROOM","height":300.0,"rotation":0.0},"e9":{"type":"text","layer":"labels","at":[2600.0,-3000.0],"text":"STUDIO PLAN","height":400.0,"rotation":0.0},"e10":{"type":"solid","layer":"model","mesh":{"vertices":[[-120.0,-120.0,-150.0],[-120.0,-120.0,0.0],[-120.0,5120.0,-150.0],[-120.0,5120.0,0.0],[8120.0,-120.0,-150.0],[8120.0,-120.0,0.0],[8120.0,5120.0,-150.0],[8120.0,5120.0,0.0]],"triangles":[[1,0,4],[2,4,0],[1,3,0],[3,1,5],[3,2,0],[3,7,2],[5,4,6],[5,1,4],[6,4,2],[7,6,2],[7,3,5],[7,5,6]]},"material":"shell","tag":"slab"}}}